{
  "schema_id": "ReuseDecisionReceipt", "schema_version": "1.0.0",
  "object_id": "reuse-s08-atomic-feedback-20260718", "issued_at": "2026-07-18T15:10:00Z",
  "issuer": {"id": "agent-0", "authority_class": "reuse-freeze-authority"},
  "contour": "governance", "classification": "D1_INTERNAL_SANITIZED",
  "payload": {
    "capability": "atomic-reference-only-feedback-memory-idea-and-single-next-trigger",
    "candidates": [
      {"candidate": "reuse-existing-JobLedger-global-a1-bundle-and-projection-transaction", "disposition": "selected"},
      {"candidate": "store-full-feedback-material-in-existing-global-ledger-event-and-latest-projections", "disposition": "selected"},
      {"candidate": "new-event-ledger-outbox-database-scheduler-or-orchestrator", "disposition": "rejected-split-ordering-and-duplicate-runtime"},
      {"candidate": "model-authored-learning-or-direct-MaterialEvent-minting", "disposition": "rejected-authority-and-epistemic-violation"}
    ],
    "selected_mode": "existing-SQLite-WAL-global-sequence-plus-atomic-feedback-bundle-with-InternalEventTrigger-outbox-and-no-schema-migration",
    "source_ref": "git:cb646b0935a4037049f19894d70b7b60944d9e8a;internal:src/research_bridge/ledger.py@db36cf71;profile:storage-coverage-v1",
    "code_sha256": "db36cf71ba04e4f1bb05208e3a0d3b9a543ff377b1f164baefbc32906f6888d2",
    "license_spdx": "NOASSERTION", "license_sha256": "e3b0c44298fc1c149afbf4c8996fb92427ae41e4649b934ca495991b7852b855",
    "tests": [
      "outcome-memory-idea-outbox-one-transaction", "exact-retry-no-duplicate",
      "mechanical-epistemic-blame-separation", "shadow-taint-inheritance",
      "positive-negative-inconclusive-operational-memory", "no-false-REFUTED-or-LEARNED",
      "zero-or-one-runnable-InternalEventTrigger", "WAIT_AUTHORITY-durable",
      "fault-rollback-no-partial-projection-or-outbox"
    ],
    "canonical_owner": "bridge-ledger-agent-1-with-agent-5-hostile-assurance",
    "rollback": "Revert the additive feedback method and projection names; the existing global ledger, A1 objects, receipts and execution path remain readable and unchanged."
  },
  "integrity": {"payload_sha256": "779f21151e1988a6a5f251c76198ba50062a8691a9ad995d07251eb499d2a2a1", "parent_refs": [
    "git:cb646b0935a4037049f19894d70b7b60944d9e8a",
    "sha256:13bdac3a60227826550771635d7367854a8a5477240ed06b2c31198dbd6f5c50",
    "integration:s07-l0-validation"
  ]}
}
