{
  "schema_id": "ReuseDecisionReceipt", "schema_version": "1.0.0", "object_id": "reuse-s37-governed-transfer-20260719", "issued_at": "2026-07-19T01:12:00Z", "issuer": {"id": "agent-0", "authority_class": "reuse-freeze-authority"}, "contour": "governance", "classification": "D1_INTERNAL_SANITIZED",
  "payload": {"capability": "METHOD_TRANSFER_REQUEST_CHAIN_AND_REPLAY_FENCE", "candidates": [{"candidate": "reuse-S35-declassification-and-S36-recipient-shadow-receipt-chain", "disposition": "selected"}, {"candidate": "reuse-existing-expiry-nonce-and-WAIT_AUTHORITY-patterns", "disposition": "selected"}, {"candidate": "stdlib-only-pure-request-validator-and-capability-proof", "disposition": "selected-minimal-missing-glue"}, {"candidate": "automatic-recipient-adoption-or-policy-mutation", "disposition": "rejected-authority-violation"}], "selected_mode": "exact-chain-bound-expiring-one-shot-request-ending-at-human-domain-authority", "source_ref": "git:64a911e4bd6bc03a4ab0e29be373fa3a3352c705;internal:S35+S36", "code_sha256": "5d895f221d6a2971dd9341c1dbf9bd74dcd21c0f5d2b129df9dce974ccd194e9", "license_spdx": "NOASSERTION", "license_sha256": "e3b0c44298fc1c149afbf4c8996fb92427ae41e4649b934ca495991b7852b855", "tests": ["exact-chain", "expiry", "replay", "taint", "no-promotion-receipt", "recipient-zero-write", "proof-integrity"], "canonical_owner": "agent-0-governed-transfer-tool-agent-5-assurance", "rollback": "Remove additive S37 request/proof layer; MethodCard and recipient remain unchanged."},
  "integrity": {"payload_sha256": "3b4e01d9a9533355eec4884a981ffc733055bc72fdc103c0360bd630e11e3032", "parent_refs": ["git:64a911e4bd6bc03a4ab0e29be373fa3a3352c705"]}
}
